title_ch,title_eng,body,hsk_level,link
不宜久坐,Do not sit for long periods of time,现代人的生活方式使他们不得不久坐。屏幕前工作、学习等让大家坐着的时间远大于活动的时间。 你知道吗？一个成年人每周至少需要进行150至300分钟的中等强度有氧运动，或者至少75至150分钟的高强度有氧运动，才能达到运动健身的标准。除了有氧运动，还需要每周至少有两天进行中等或更高强度的无氧运动，锻炼你的主要肌肉群。 研究发现，即使你满足了这些运动时间，但是每天久坐达到11个小时以上，则会削弱你的运动效果。久坐，特别是不良姿势的久坐，还会带来很多对身体的负面影响，增加各种慢性疾病的发生风险，增高死亡风险。 怎么解决这个问题呢？世界卫生组织建议大家可以尝试打断久坐的状态。每半个小时或一个小时就站起来活动身体，这样可以预防久坐行为带来的健康风险。除此之外，我们还可以见缝插针地活动身体，例如多走路，少外卖，下班后直接去健身房等，保证每天足够的活动时间，这样才能培养好的健康习惯。,4,https://mandarinbean.com/do-not-sit-for-long-periods-of-time/
送礼物,Send a Gift,如果你的朋友结婚，你会送什么礼物？如果问你的中国朋友，可能他们会说：没关系，不需要礼物。当然，这么重要的事情，我们不可能不送礼物。大多数人一般会送钱，因为买东西很麻烦，结婚的朋友可能不需要或者不喜欢这个礼物，送钱很简单，也能表达自己的祝福。如果去朋友家玩，一般可以买一束花，一盒茶，一些好吃的东西，或者一瓶酒，这些礼物都可以。,3,https://mandarinbean.com/send-a-gift/
元宇宙,Metaverse,不久前，脸书（Facebook）的CEO表示，未来几年，脸书将从一家社交媒体公司变成一家元宇宙公司，因此掀起了一阵全球元宇宙热。其实除了脸书以外，微软、腾讯等大公司都提出了类似元宇宙的解决方案。 究竟什么是元宇宙？元宇宙的英语是Metaverse，最早出现在一本美国的科幻小说中。小说描绘了一个虚拟数字世界，而里面的人都有一个虚拟身份，人们通过控制这个虚拟身份相互竞争，提高自己的地位。 元宇宙这个概念的火爆首先主要是在需求方面，新冠疫情减少了人们的物理联系，增加了虚拟世界的互动时间，需求也逐渐增加。其次，随着技术的发展，很多科幻世界里的场景已经开始变为现实。除了需求和技术，当然还有经济的因素，很多大公司看到了元宇宙的商业前景，除了游戏，还有社交、购物等多方面的机会，这是大家都期待并看好的新一轮增长可能。 目前，无论是技术、规模还是质量，元宇宙依然没有成熟，一切都还在创建中。,4,https://mandarinbean.com/metaverse/
最喜欢的国家,Favorite country,我和家人们现在越来越喜欢出国旅游。我的哥哥喜欢去日本，因为他很喜欢日本文化。我的妈妈喜欢欧洲，因为欧洲有很多漂亮的城市。我的爸爸喜欢美国，因为那些国家公园的自然环境很美。我最喜欢泰国，很多泰国人都能说一点儿英语，去哪儿都很方便，还有漂亮的海和好吃的食物。泰国一直是夏天，这也是我最喜欢的季节。如果能一直在泰国生活就好了！,3,https://mandarinbean.com/favorite-country/
鸡娃,Tiger parenting,你知道“鸡娃”是什么意思吗？如果你认为是鸡的孩子，那就错了。 想要明白这个词，我们首先要知道“打鸡血”的意思。“打鸡血”是一种80年代的保健方法，就是把一岁大公鸡的血注射给人类，据说打了鸡血，就会精神亢奋。当然这种方法并不科学，坏处很明显。因此后来很多人用“打鸡血”这个词形容一些人突然情绪亢奋的现象或者疯狂的状态。 这几年，因为学习竞争非常激烈，为了让孩子变得更优秀，赢在起跑线上，很多家长逼孩子学习很多额外的东西，让孩子和父母都身心疲惫。大家觉得这种疯狂的养育方式就好像在给孩子“打鸡血”，简称“鸡娃”。这里的“鸡”已经从名词变成动词的用法了。,4,https://mandarinbean.com/tiger-parenting/
德国的“中国人”,“The Chinese” in Germany,德国有一个漂亮的小镇，小镇上有6000多个人，从孩子到大人，都是欧洲人的样子。但是，他们却说自己是中国人，自己的小镇是中国人的王国，甚至把汉语也作为小镇的官方语言。每年中国春节，这里都会有热闹的中国狂欢节，大人和孩子都认真地庆祝。据说，这是因为几百年前这里的人就开始和中国人做生意，慢慢喜欢上了中国文化，就开始过中国狂欢节了。,3,https://mandarinbean.com/the-chinese-in-germany/
躺平,Lying flat,“躺平”这个词原本的意思是平卧，也指休息。现在网络上有很多“躺平族”，这是什么意思呢？原来，这里的“躺平”指的是一种不反抗、不努力、不行动的生活态度，把这种态度作为生活理念的群体就是“躺平族”。他们面对生活中的各种压力，选择躺平。 但是，现实生活中，其实很多高喊“躺平”的人并没有真正躺平，依然在努力生活。他们只是在用这种方式嘲讽和反抗现在巨大的生活压力和竞争。,4,https://mandarinbean.com/lying-flat/
野性消费,Wild consumption,2021年7月，河南省遭遇了特大洪灾，一个中国运动品牌低调地捐赠了5000万元的物资帮助河南。这件事被网友发现后，纷纷去这个品牌的网络直播间购物，表达自己对这个品牌的欣赏和支持。由于购物的人太多，消费太多，直播间的主播劝网友理性消费，而大家则表示自己要“野性消费”，也就是不受约束地消费。 当然这种野性消费也有原因，首先是大家对爱心企业的支持，其次就是中国制造的产品质量越来越好，产品物美价廉，让大家可以放心地消费。,4,https://mandarinbean.com/wild-consumption/
梦想房间,Dream room,每个人都有一间自己的梦想房间。孩子更是特别希望有属于自己的房间。最近，上海有一个新计划，帮助家庭有困难的孩子改造自己的梦想房间。房间会改造墙、地、床、灯、桌子、椅子等。刚刚得到自己梦想房间的王同学表示，希望努力学习，以后也可以帮助更多人。,3,https://mandarinbean.com/dream-room/
请病假,Ask for sick leave,最近，王先生因为牙齿痛，预约了两天的牙科检查和治疗，还跟公司请了带薪病假。后来，牙科诊所因为安全检查的原因取消了王先生第一天的预约，而王先生自己把第二天的预约也取消了。虽然牙科预约都取消了，王先生却没有向公司申请取消病假，而是去了香港旅游，还在微信分享自己的旅游照片。公司发现了他在微信的旅游照片，要求他提供这两天的看病记录。因为王先生没有办法提供，公司认为他严重违反了公司的规定，把他开除了。,4,https://mandarinbean.com/ask-for-sick-leave/
教师家庭,The family of teachers,广州市有一个中学的数学老师叫吴晖晖，她已经当老师29年了。她的爷爷是中国著名的教育家，她的爸爸、妈妈都是老师，一生都在做乡村教育。吴老师的其他家人中，有三十多人都在不同的城市做教育工作。她自己的女儿现在也在当老师。一家四代人都相信，教育是伟大的事业，这也是他们一生的追求。,3,https://mandarinbean.com/the-family-of-teachers/
危险的报复,Dangerous revenge,近日，浙江的一个交警指挥中心发现，市区内一辆汽车两天里违反交通规则50次。这辆车的主人钱先生表示这两天将自己的车租给了别人。交警又联系到租车的人，才发现，这个男人是为了替自己正在追求的女士报复前男友，就租了他的车，并故意闯红灯49次、超速驾驶1次。而这些行为都是这位女士要求的。原来钱先生与这位女士交往过，但最近钱先生对这位女士十分冷淡，还不时在朋友圈展示与其他女人的合照，这位女士就产生了不满，想用这种方式报复他。最后，租车的人和这位女士都被抓起来了。,4,https://mandarinbean.com/dangerous-revenge/
骆驼逃跑了,Camel escaped,江苏的一个动物园里，一只骆驼悄悄地逃跑了。它逃跑以后在街上散步，后来可能是走累了，骆驼走进了街边的一家烧烤店。警察赶到后，借来玉米喂骆驼，引导它到安全的地方。20分钟以后，动物园的工作人员赶来把骆驼接回了动物园。,3,https://mandarinbean.com/camel-escaped/
中国人最喜欢的英国景点,The Chinese favorite spots in the UK,很多中国人喜欢去英国旅行，因为英国不仅有历史，也有时尚。随着中国游客的数量越来越多，英国也很希望不断提高游客的体验，想知道中国人究竟喜欢什么。最喜欢的是美丽的湖区，女王的住处，还是牛津街的大商场？ 经过调查，80%的人都没想到，原来中国游客最喜欢去的地方是白金汉宫，也就是女王的住处。第二喜欢去的居然是比村，为什么呢？原来这里除了可以买便宜、品质好的商品，还有针对非欧盟顾客的退税服务。中国游客在这里可以用中国的手机支付软件，中国店员很多，连火车上的语言都有普通话。除了买买买，剑桥大学的国王学院也是中国游客很喜欢去参观的地方，因为中国的一位著名诗人曾经在这里学习，他有很多优美的诗也是在这里写的。 对中国游客来说，王室、购物、中国情结都是吸引他们的原因。,4,https://mandarinbean.com/the-chinese-favorite-spots-in-the-uk/
活到老，学到老,Live and learn,今年6月，家住上海的一位老人获得了中国美术学院的双学士学位，从中国画专业顺利毕业。老人名叫徐安玲，1951年出生，今年已经70岁了。 徐安玲现在还清楚地记得自己上大学的第一天。她走进教室时，一群二十多岁的年轻学生都以为她走错教室了，甚至有人以为她是哪位同学的家长。进入大学以后，繁重的学习带给她很大的压力。别的年轻学生每天练习3-4小时，她只能靠更勤奋的练习来弥补自己的不足。她永远是班上第一个到教室，最后一个离开的人。 她从小就喜欢用铅笔画画，参加工作以后忙碌的工作生活让她放下了画笔，但是这个爱好一直没变。退休后，在她58岁那年，她重新拿起了画笔。现在她终于顺利毕业了。家人们也都很支持她退休之后追寻梦想的做法。她也将自己的一部分作品留给家乡，因为那是自己的梦开始的地方。,3,https://mandarinbean.com/live-and-learn/
密码锁,Coded lock,27号凌晨1点左右，起床上厕所的大爷突然发现自己家中进来一个陌生人，赶紧叫自己的儿子报警说有陌生人把自己家的门打开了。警察很快到了现场。这个陌生人解释说他走错了，他是住在隔壁单元的，谁知道他们两家的大门密码锁是一样的，门就被他打开了。大爷和家人表示不相信，这怎么可能呢？然后在警察的见证下，让这个陌生人把他自己家的门打开，结果他家的门真的开了，并且这两家的大门密码确实完全一样。警察又查证了他的身份，发现他说的也都是真的。大家都觉得太巧了。,4,https://mandarinbean.com/coded-lock/
偷东西,Stealing,最近，杭州警方抓到了三个来自福建的小偷。他们在地图上随便选择了一个地方准备偷东西，就花了1000多元钱打车来到杭州。结果偷了东西之后不到7个小时，就被警察抓到了。小偷说：你们这里的东西太难偷了，我们晚上才到这里，准备晚上偷了东西，早上就走，可是到处是报警器、警察，店里也偷不到东西，逃也逃不掉。小偷们最后偷到的东西比他们来时的路费还少7块钱。,3,https://mandarinbean.com/steating/
怎么喝水最合适？,How should we drink water?,我们都知道水是生命之源，那每天应该喝多少水，应该怎么喝才合适呢？对于健康的成年人，每天应该补充1500~1700毫升的水；如果是儿童，则应该少于成年人，但也随着年龄的增加而增加。当然，具体的饮水量还是要根据劳动强度、出汗多少以及气温情况来决定。 喝水，最好不要选择含糖饮料代替纯净水。温度不要超过50摄氏度，20~30摄氏度的温开水是最好的，温度太高可能会伤害身体。不要一次喝太多太快，少量多次是比较科学的喝水方法。 那如何知道今天的水喝够没有呢？一个简单的办法就是通过尿液来判断。如果尿液是淡黄色，那就是基本正常；如果是深黄色，说明身体处于缺水状态，应该及时补水；如果是透明无色的，说明水过量了，应该适当减少喝水。现在，你会喝水了吗？,4,https://mandarinbean.com/how-should-we-drink-water/
帮助睡眠的食物,The food that helps sleep,我们都知道甜的食物容易让人感觉开心和兴奋，但是少量地吃一些甜的食物却能帮助你睡觉睡得更好。比如，如果你在晚上喝水或者喝牛奶的时候加一点蜂蜜，那就会让你的睡眠更好。除了蜂蜜，在睡觉前吃一点香蕉也对你的睡眠有帮助，并且吃香蕉还不容易长胖。第三种帮助睡眠的食物是杏仁，平时多吃点杏仁能帮助缓解你的焦虑，提高睡眠的质量。,3,https://mandarinbean.com/the-food-that-helps-sleep/
正确的方向,The right direction,从前，有一个人要从魏国到楚国去。他带了很多钱，雇了好车和快马，请了很优秀的车夫，就上路了。楚国在魏国的南面，可这个人却让车夫驾着马车一直向北走。 路上有人问他要往哪儿去，他大声回答说：“去楚国！”路人告诉他说：“到楚国去应该往南方走，你这是往北走，方向不对。”那人不在乎地说：“没关系，我的马快着呢。”路人替他着急，拉住他的马，阻止他说：“方向错了，你的马再快，也到不了楚国。”那人依然不以为然：“不要紧，我带的钱多着呢。”路人又劝阻他说：“虽说你的钱多，可是你走的不是那个方向，你的钱也只能是白花。”那人有些不耐烦地说：“这有什么难的，我的车夫驾车的本领高着呢。”路人无奈，只好看着他走了。 那个魏国人，觉得自己的马快、钱多、车夫好，就朝着相反方向一意孤行。那么，他条件越好，他就只会离他要去的地方越远，因为他的方向是错的。这个故事告诉我们，无论做什么事，都首先要找到正确的方向，才能充分发挥自己的有利条件；如果方向错了，那么有利条件只会起到相反的作用。,4,https://mandarinbean.com/the-right-direction/
语言的学习技巧,Language learning skills,世界上越来越多的人都在学习至少一个或者两个外语，那么怎么才能更好地学习和掌握一门新的语言呢？ 首先你要知道，年龄永远不是问题。当然，如果能从小就开始学习一门新的语言，那当然最好。但这也不意味着年龄大的人就不可能掌握新的语言了，什么时候开始学习都不晚。好奇心和努力才是最重要的。每天学习一个小时或者半个小时会比间隔很长的学习效果好很多。 你可以先从一些简单的词语和句子开始，多听、多看，慢慢地习惯这种新的语言，熟悉它，再跟着书或者老师开始系统性的课程学习。现在网上有很多免费的和付费的语言学习内容，只要你想，就能找到很好的语言课。 如果你有一个好的语言环境，那会很好地帮助你的学习。很多人都会通过电影或者音乐来熟悉一门语言。电视上的很多画面也对语言学习者很有帮助，能学习到更真实的、常用的句子和词语。,3,https://mandarinbean.com/language-learning-skills/
守株待兔,Wait for the rabbit under the tree,古时候，有个农民正在田里劳动。突然，他看见一只兔子从旁边的草丛里慌慌张张地跑出来，一头撞在田边的大树上，便倒在那儿一动也不动了。农民走过去一看：兔子死了。因为它奔跑的速度太快，把脖子都撞断了。农民高兴极了，他一点力气没花，就白捡了一只又肥又大的兔子。他心想：要是天天都能捡到兔子，那日子就好过了。从此，他再也不肯出力气劳动了。每天他吃完饭就躺在大树底下，等待着第二只、第三只兔子自己撞到树上来。世上哪有那么多便宜的事啊。这个农民当然再也没有捡到撞死的兔子，而他的田里也没有收获任何粮食，农民只好饿着肚子过年了。这个故事就是我们熟悉的成语“守株待兔”。,4,https://mandarinbean.com/wait-for-the-rabbit-under-the-tree/
跟谁姓？,Whose surname?,浙江有一对刚结婚三个月的年轻夫妻因为孩子的姓名问题离婚了。原来，他们在恋爱时曾经讨论过，如果以后孩子出生，女方想让孩子跟妈妈姓，而不是传统的跟爸爸姓。但在孩子出生以后，男方的父母却不愿意第一个孩子就跟妈妈姓，而女方家也非常坚持。法律规定孩子可以跟爸爸姓，也可以跟妈妈姓，由父母自己自由决定。但他们的孩子跟谁姓还是没有决定，而夫妻俩的矛盾开始越来越多，关系也越来越差，最后只能离婚了。,3,https://mandarinbean.com/whose-surname/
体育与气候,Sports and climate,根据最新研究，极端天气可能会在以后比过去更多地干扰体育比赛。 高尔夫可能就是我们不断变化的气候的受害者之一。如果海平面继续上升一些，到本世纪末，很多高尔夫球场可能会被淹没。 到2050年，据估计，英国足球赛中几乎有四分之一的球场预计每年都会被淹没。这意味着减少比赛次数，减少观看精彩比赛的机会，并减少门票销售收入。 除了高尔夫和足球，随着全球温度的上升，全球板球运动也面临着很大的挑战。 解决方案在于减少人类的碳足迹，比如，减少参加体育比赛的旅行，并减少旅行时的浪费。但是这个方案却没有被很好地实施。,4,https://mandarinbean.com/sports-and-climate/
求救,Ask for help,最近，南京的一个二十岁的年轻人不小心落水，在湖里漂流了两天被发现,3,https://mandarinbean.com/ask-for-help/
把瓶子装满,Fill the bottle,孩子们因为琐事打了起来。妈妈就把一个大玻璃瓶子拿出来，瓶子里装着满满的石头、玻璃碎片和沙子。之后，妈妈让孩子们把瓶子里的东西都倒出来，然后再装进去，先从沙子开始。 每个孩子都试了试，最后都发现没有足够的空间装所有的石头。 妈妈指导孩子们重新装这个瓶子。这次，先从石头开始，最后再装沙子。石头装进去后，沙子就沉积在石头的周围，最后，所有东西都装进瓶子里了。 妈妈说：“如果我们先从小的东西开始，把小东西装进去之后，大的石头就放不进去了。生活也是如此，如果你的生活先被不重要的事挤满了，那你就无法再装进更大、更重要的事了。”,4,https://mandarinbean.com/fill-the-bottle/
青岛啤酒节,Qingdao Beer Festival,青岛啤酒是中国很有名的啤酒。在青岛，除了春节、中秋节等传统节日以外，啤酒节也是很重要的一个节日，并且越来越有名。这个啤酒节开始于1991年，每年8月的第二个周末开幕，一共16天。在啤酒节上，除了青岛啤酒，你还可以喝到世界上不同地方的啤酒。街道两边有各种歌舞和活动，非常精彩有意思。你想不想来了解一下啤酒文化？快来参加吧！,3,https://mandarinbean.com/qingdao-beer-festival/
我的婚姻生活,My marriage,刚结婚的时候，我只是一个普通的医生，我丈夫还是个中学老师，每天生活都很规律，我们俩每天早上起床后，一起吃早餐，看新闻，然后一起出门上班，生活很幸福。十年过去了，现在他已经是校长了，我也成为了医院的主任，我们的职位越来越高，工作也越来越忙，每天早上我起床后都看不到他，晚上我回家的时候他已经睡了。我们一起吃饭、交流的机会越来越少，偶尔见面，也不知道应该说什么了。曾经希望我们可以少一些会议，多一些休息，可以像以前一样经常在一起，但是大家都不愿意放弃自己的事业，最后我们只能离婚了。,3,https://mandarinbean.com/my-marriage/
嫦娥奔月,Chang’e to the Moon,嫦娥是中国神话里住在月亮上的仙女，她原来是英雄后羿的妻子。因为后羿为老百姓做了很多好事，大家都很尊敬他。但是因为后羿经常不能回家，嫦娥每天都很孤单，只有一只小白兔陪着她。 有一天，后羿得到一瓶神药，回家以后就把药给了妻子，还告诉她吃了这个药可以长生不老，等他回来以后一起吃，然后就离开了家。嫦娥太寂寞了，就偷偷地尝了这个神药，她想可能吃了神药就不寂寞了吧。不知不觉，她把一瓶药都吃了。她觉得自己渐渐变轻了，连忙抱起小白兔，尽管这样，她还是飞了起来，一直飞到了月亮上。后来，她就只能在月亮上住了。 后羿回家以后发现妻子和药都不见了，他难过极了，不明白为什么妻子不等他回来一起吃。而月亮上的嫦娥更寂寞了。月圆的时候，我们还能看到月亮上她和小白兔孤单的影子。,4,https://mandarinbean.com/change-to-the-moon/
还电脑,Return Computer,最近，深圳的一个停车场里，一个车主在停车后忘记锁车门，结果放在车后座电脑包里的很多现金被偷了。车主回到车上发现以后，就报警了。警察通过停车场的视频发现了偷东西的小偷，他打开车门把车主的电脑包拿走了。但是车主说只有现金被偷了，电脑包还在车里，这让警察很惊讶。他们又继续看视频，发现一个多小时以后，小偷回到了这辆车旁边，把电脑包放回去了。警察抓到小偷以后问他为什么，才知道小偷担心电脑里可能有重要的资料，如果电脑不见了，车主肯定很着急，他就拿走了现金，把电脑、手机和一些重要的证件放回了车里。,3,https://mandarinbean.com/return-computer/
南北之争,The dispute between southerners and northerners,你可能经常听中国人介绍自己是南方人或者北方人，在生活中，中国的南方和北方有不少不同。比如，南方人大多数喜欢吃甜的东西，所以豆腐脑在南方是甜的，西红柿炒蛋也会放一点糖，但是这两种吃的东西在北方都是咸的。但有意思的是，吃粽子的时候，南方人喜欢吃咸粽子，北方人却喜欢有枣子加糖的甜粽子。如果你到中国来，一定要试一试南方和北方不同的味道。,3,https://mandarinbean.com/the-dispute-between-southerners-and-northerners/
愚公移山,Yu Gong moves the mountains,很久以前，有一个叫愚公的老人，他家门口有两座大山，挡住了他们一家的路，不管去哪儿，都得翻过这两座山，很不方便。 于是，愚公决定带领全家一起把这两座大山搬走，而这个时候，愚公已经90多岁了。家人都同意他的决定，但是他的妻子问他：你年纪那么大了，怎么可能搬走大山呢？再说，那么多土和石头也没地方放啊！这真是个好问题。大家商量后决定把这些土和石头运到东边的大海里去。第二天，愚公就带着全家人开始挖大山了，即使很小的孩子也去帮忙。他们把土和石头从家里运到海里，一次就需要一年的时间。他们不停地工作着，一天也没休息过。 有一个聪明的老人觉得愚公的行为太可笑了，就嘲笑愚公说他不可能搬走大山。愚公说即使自己死了，还有儿子，儿子死了，还有孙子，可以永远挖下去，当然可以成功。 后来，天上的玉帝被愚公家不怕困难的精神感动了，就派两个神仙把两座大山移动到别的地方了。 现在我们用“愚公移山”这个成语来形容不管多么困难，只要有毅力，坚持下去，最后就一定能成功。,4,https://mandarinbean.com/yu-gong-moves-the-mountains/
汉字,Chinese characters,汉字是用来记录汉语的书写符号。汉字是世界上最古老的文字之一，已经有六千多年历史了。很多人觉得汉字非常难，因为看起来像图画，其实最早的汉字就是画出来的，最后变成了我们现在的汉字。 汉字有多少个？将近十万个，但没有一个准确的数字。我们日常生活中需要用到的汉字只有3000多个。现代汉字包括繁体字和简体字两种。 汉字的历史里有很多中国文化，所以如果想真正地学习汉语，了解中国，就开始学习汉字吧！,3,https://mandarinbean.com/chinese-characters-story/
