title_ch,title_eng,body,hsk_level,link享受假期,Enjoy the holidays,现在人们越来越忙，很多在大城市工作的人已经不知道怎么享受假期了。 放假的时候，你可以花时间做你想做的事情。看电影、睡觉、运动……任何事情都可以！当然，如果我们能在假期利用时间收拾屋子和衣服，假期结束的时候，你也会感到度过了有意义的时光。平时我们总是忙于工作，无法参加足够的社交活动，这也是你联系老朋友和家人的好机会。你还可以做一张愿望清单，把想做的事情都写下来，完成一件，划掉一件，你会越来越有成就感。如果第二天你就要工作了，记得不要熬夜，早睡早起。 假期是我们身体和心理放松的时间，我们都应该好好珍惜。,4,https://mandarinbean.com/enjoy-the-holidays/
看电影,Watch movie,我喜欢看电影，在我很小的时候就和妈妈一起看了很多电影了。有些人认为这是浪费时间，但是我想告诉他们，他们的想法是错的。看电影也可以是一种好的学习方法。我们可以从电影中看到很多精彩的人生，了解不同的文化，甚至是历史。因为看了很多外国电影，我的外语听力和词也学习了很多。这真是一种特别有趣的学习方式啊！,3,https://mandarinbean.com/watch-movie-2/
面试小技巧,Interview tips,细节决定一切，面试时也不例外。即使你认为自己的简历已经很完美，也要注意一些后续步骤。例如，和雇主第一次接触到面试后发送的感谢信，邮件或者相关资料的拼写是否正确，面试是否准时，都很重要。现在，很多的招聘人员也经常通过社交媒体网站了解面试者的性格，这也是招聘的一部分。因此，大家也要注意自己社交媒体的内容。,4,https://mandarinbean.com/interview-tips/
我爱火锅,I love hot pot,每次不知道吃什么的时候，我们就会去吃火锅。火锅非常好吃，我们可以选择自己喜欢的味道和食物。一群人坐在一起吃不同口味的菜，真的很方便，也很热闹。许多外国人来到中国以后最喜欢的就是火锅了。现在火锅已经像饺子一样成为了中国饮食的象征。,3,https://mandarinbean.com/i-love-hot-pot/
中国的秋天,The Autumn in China,中国位于北半球亚热带地区，夏天以后，连续五天平均气温在22℃以下时就进入了秋天，低于10℃时秋天结束。按节气，秋天从立秋开始，到立冬结束。中国的东北地区是秋天来得最早的地方，气温渐渐下降，树叶开始变色，白天变短，夜晚变长。中国的秋天，特别是北方，比较干燥，所以应该多吃蔬菜和水果，增加运动量，注意不要感冒。如果你想来中国旅游，秋天也是一个非常合适的季节，不管是北方还是南方，都有很美的秋天的风景，气温也很舒服。,4,https://mandarinbean.com/the-autumn-in-china/
生活的改变,Change of life,为了学习汉语，我来到了中国生活。到了新环境意味着我不得不放弃很多东西，比如我亲爱的老朋友和美丽的风景。首先，我必须学会适应陌生的环境。当我有时间，我就会在街上走，熟悉商店和街道。然后我发现了一些有趣的地方，比如一些小咖啡店。小店提供了很多书，我可以在里面看书。我没有多少朋友，我有点孤独，但是我的同学都很好，他们帮助我解决问题。现在我有了很多好朋友，感觉在中国就像在家一样。我会在这里找到更多的惊喜。,3,https://mandarinbean.com/change-of-life/
广场舞,Square dance,广场舞已经成为中国文化的一部分。退休的男人和女人会在早上或晚上在广场上跳舞，作为常规的锻炼。但中国年轻一代并不认为这是一件很酷的事，他们觉得跳广场舞是老年人做的事，年轻人做会很尴尬。但很多国外的媒体赞扬广场舞，他们认为老人在做着很棒的事情，在享受生活，队伍是如此的庞大，他们的组织工作做得很好。可能中国的年轻人应该多给老人们一些支持和理解。,4,https://mandarinbean.com/square-dance/
醉酒,Get drunk,吃完饭后父亲与儿子一起回家。这个孩子对什么事都很感兴趣，总是有提不完的问题。他问父亲：爸爸，“醉”字是什么意思？ 父亲回答说：你瞧那儿站着两个警察。如果我把他们看成了四个，那么我就算醉了。 孩子说：可是，爸爸，那儿只有一个警察！,3,https://mandarinbean.com/get-drunk/
“胖”是工伤,“Fat” is an industrial injury,调查显示，有84.8%的人表示参加工作以后体重增加，其中33.2%的人甚至超重。“胖”是一种最普遍的工伤。这里是十大又累又容易发胖的职业，你的工作是什么？ 1.新媒体，广告人 2.行政助理 3.IT工作者 4.销售 5.设计师 6.老师 7.医生，护士 8.外卖员 9.司机 10.厨师,4,https://mandarinbean.com/fat-is-an-industrial-injury/
赚钱不容易,Making money is not easy,最近，江苏南京的一位妈妈因为发现自己的两个孩子对花钱没有概念，特别容易浪费，就为他们租下了一个摊位，让自己11岁的儿子和3岁的女儿一起在高温天气卖花生。这位妈妈想通过这种方式让孩子们明白赚钱不容易，花钱要注意。在这次体验以后，三岁的女儿看到玩具太贵，也不要求买了。,3,https://mandarinbean.com/making-money-is-not-easy/
我,Me,我从大学毕业以后，第一份工作是在公司里当职员，后来我发现生活太无聊了，整天坐在办公室里，所以我决定辞职。辞职以后我去了很多地方，开阔了视野，遇见了很多人，看到了很多风景。当我遇见我现在的丈夫，我知道是时候安定下来了，然后回家找了一份适合我的工作。,4,https://mandarinbean.com/me-story/
免费拿零钱,Get free changes,最近，一个来自中国河北省的小学生把自己差不多700元钱的积蓄都换成了硬币零钱，免费提供给所有需要帮助的人们，但是每次只能拿两元。他说想帮助解决大家坐公共汽车，但是却没有零钱的麻烦。网友们纷纷为小朋友点赞。,3,https://mandarinbean.com/get-free-changes/
疯狂的司机,Crazy Driver,一位高龄老人在高速公路上驾驶时，接到了妻子打来的电话，妻子焦急地告诉他说：老公，小心！我刚从新闻上看到报道说，在280号公路上有一个疯子正在开车逆行！ 开车的老人说：我知道，可是不是一个，而是成百上千个！,4,https://mandarinbean.com/crazy-driver/
肩膀,Shoulder,我很小的时候认为身体最重要的部位是眼睛，因为眼睛可以看见蓝天、看见白云、看见我们爱的人。奶奶说：这个世界上有很多盲人啊。 后来我开始学习音乐，我认为身体最重要的部位是耳朵或者嘴，因为耳朵可以听到世界上最美的声音，嘴可以唱出好听的歌。爷爷说：但这个世界也有很多聋哑人。 几年以后，我好朋友的爸爸去世了，她非常伤心，我陪着她度过了那段不开心的日子。回家以后，妈妈对我说：现在，你知道最重要的部位是哪了吗？没错，是肩膀。因为在我们爱的人哭泣的时候，肩膀可以让他们依靠。我们每个人都需要肩膀，我们自己也要有强壮肩膀留给别人。,3,https://mandarinbean.com/shoulder/
数字忌讳,The Taboos about Numbers,很多国家对数字都有自己的迷信，他们认为最好避免这些数字，否则不好的运气就会随时降临。 在中国，数字4被认为是最不好的数字，因为在普通话里听起来像“死”。许多商人避免使用4来避免坏运气。在一些地方，人们甚至看不到四楼，从三楼就直接到五楼了，如果人们看到四楼，就会觉得不舒服。 在一些西方国家，数字13被认为和中国的4具有一样的意义。他们认为，如果周五是13号，那肯定是不幸的一天，所以他们会称之为“黑色星期五”。他们会呆在家里，避免厄运。无论他们什么时候看到13，都会感到恐慌。 当然，没有证据可以证明这些数字忌讳的科学性，年轻一代也并不在意，越来越忽视这些迷信。,4,https://mandarinbean.com/the-taboos-about-numbers/
愚蠢的问题,Stupid question,很多人逗小孩的时候总是喜欢问他们一些很难回答的问题，比如：你更爱爸爸还是妈妈？这其实是一个非常愚蠢的问题。每个人都喜欢自己的父母，不需要比较。这样的比较不但会让孩子为难，也会伤害父母的感情。所以，请大家不要总是问这些愚蠢的问题，要尊重孩子。,3,https://mandarinbean.com/stupid-question/
如何定义成功,How to define success,小时候我们经常被问想成为一个什么样的人。很多孩子会说：一个成功的人。但是，什么是成功呢？ 当我们谈论成功，自然会想到名声和巨大的财富。很长一段时间里，电视上的成功人士形象总是很有钱或者有权力的人。慢慢地，我意识到我们对成功的看法是很狭隘的。很多有钱人也会感到迷茫，很多有权力的人也会迷失自我。 拥有积极的生活态度和幸福的生活，这些才是最宝贵的。如果能快乐地生活，那么这个人就是成功的。,4,https://mandarinbean.com/how-to-define-success/
迟到,Be late,小明上中文课迟到了。他对中文老师说：对不起，我迟到了，老师。我梦见了一场足球赛。 老师问：那为什么会迟到呢？ 小明回答说：因为两个队不分胜负，所以踢了很长时间。,3,https://mandarinbean.com/be-late/
请为你的夸奖道歉,Please Apologize for Your Compliment,有一次，朋友去一个教授家中做客。教授有个五岁的小女儿，长得非常漂亮。朋友对小女孩说：”你长得真漂亮。”并把带去的礼物给了她。小女孩有礼貌地微笑着说：”谢谢。”教授等女儿离开后，很严肃地对朋友说：”请你为你刚才的夸奖道歉。” 朋友感到很吃惊，但是教授继续说：”你夸孩子漂亮，孩子很可能会把天生的美丽看成是她值得骄傲的资本，这是一种错误的引导。不过你还有机会弥补，你可以夸奖她的微笑和有礼貌，这是她自己努力的结果。”后来朋友就很正式地向教授的小女儿道了歉，同时表扬了她的礼貌。 对孩子容貌的夸奖需要谨慎，因为从他们成长的角度来说，对他们良好行为的夸奖更加重要。,4,https://mandarinbean.com/please-apologize-for-your-compliment/
一句漂亮的话,A Beautiful Word,牛津大学有一个叫凯丽的女孩。上大学前，她一直都是好学生，但到牛津大学后，她却成为了全班最差的学生。其实，并不是凯丽不聪明，也不是她不努力，而是她太自卑了。 一天，凯丽正在上课，有个人走进教室说，他要在班里找一个最漂亮的女孩做他们公司的形象代言人。这个人看了看教室里的学生，最后指着凯丽说：”就是她，她是我眼中最美丽的女孩。” 其实，这个人是凯丽的父亲找来的，为的是帮助凯丽找回自信。从此，凯丽又有了自信，并成为了一个优秀的学生。,3,https://mandarinbean.com/a-beautiful-word/
瓷器中的人生哲理,Philosophy of Life in Porcelain,去旅游时,4,https://mandarinbean.com/philosophy-of-life-in-porcelain/
三个博士兄弟,Three Doctoral Brothers,兄弟三人都是博士，并且都从事太空研究工作。一天，三兄弟和自己的妻子去母亲家里吃饭，吃完后，他们就开始讨论有关太空研究的问题。 妻子们和母亲在厨房洗碗，其中一个妻子说：”他们讨论的事是我完全不懂的，听着会让我觉得自己很笨。”母亲却讲了一段话，使大家恢复了自信。她说：”刚开始我也觉得自己很笨，可是有一次，他们花了两个小时才做了一碗非常不好吃的面条。从那以后，我就不再那么想了，因为每个人都有自己的长处和短处。”,3,https://mandarinbean.com/three-doctoral-brothers/
态度决定未来,Attitude Determines the Future,有三个工人正在砌墙。有人问他们：”你们干什么？” 第一个人不耐烦地说：”没看见吗？我砌墙！”第二个人抬头苦笑着说：”我们在盖一栋高楼。不过这份工作真是不轻松啊。”第三个人高兴地说：”我们正在建设一座城市。我们现在所盖的这栋大楼未来将成为城市的标致性建筑之一啊！能参与这样一个工程，真是让人兴奋。” 十年后，第一个人依然在砌墙；第二个人坐在办公室里画图纸——他成了工程师；第三个人，成了一家房地产公司的总裁,4,https://mandarinbean.com/attitude-determines-the-future/
请迈出第一步,Please Take the First Step,有一个人要到另外一个美丽的城市去，那个城市很近，走路只要1个小时。正因为近，这个人就不着急，始终不愿意迈出第一步。他每天要喝茶，要看电视，要听音乐……总之，要做的事情太多了，他太忙了。 他没有忘记自己还要赶路，可是真到下决心要走时，就又安慰自己：”反正1个小时就到了，不用着急。” 就这样，虽然那个美丽的城市很近，但是这个人一生都没能到达目的地。不迈出第一步，再近也到不了！,3,https://mandarinbean.com/please-take-the-first-step/
惯性思维,Inertial Thinking,一家酒店经营得很好，老板准备开展另外一项业务。由于没有太多的精力管理这家酒店，所以他打算在三个部门经理中选出一位总经理。 老板问第一位部门经理：”是先有鸡还是先有蛋？”第一位部门经理立刻回答：”先有鸡。”老板接着问第二位部门经理同样的问题，第二位部门经理肯定地回答：”先有蛋。”最后，老板对第三位部门经理说：”你觉得是先有鸡还是先有蛋呢？”第三位部门经理认真地回答：”客人先点鸡，就先有鸡；客人先点蛋，就先有蛋。”老板笑了，他决定选第三位部门经理做这家酒店的总经理。 当我们换个角度，跳出惯性思维的限制时，我们就走上了一条新路。,4,https://mandarinbean.com/inertial-thinking/
十分钟的人生,Ten Minutes of Life,父亲与儿子做游戏：10分钟代表一个人的一生，在这10分钟里，每人从一本书里找“黄金”这个词语，谁找得多谁就赢……游戏开始后，儿子和父亲都找得很努力。9分钟的时候，儿子一共找到了10个，而父亲却只找到了4个。” 爸爸，你输了。”儿子兴奋地说。父亲说：”我承认我输了。可是就这么结束了吗？”父亲看了看时间，说：”9分40秒了，10分钟的一生很快就要结束了。虽然你有很多黄金，但是你已经没有时间去享用了，其实时间比黄金更宝贵！”,3,https://mandarinbean.com/ten-minutes-of-life/
磨斧子,Grinding Axe,有个工人在一家木材厂找到了一份工作，报酬不错，工作条件也好，所以他很珍惜，下决心要好好干。 第一天，老板给了他一把锋利的斧子。这一天，这个工人砍了18棵树。老板说：”不错，就这么干!”工人很受鼓舞，第二天，他干得更加起劲，但是他只砍了15棵树。第三天，他加倍努力，可是只砍了10棵。工人觉得很惭愧，跑到老板那儿道歉，说自己的力气好像越来越小了。 老板问他：”你上一次磨斧子是什么时候?””磨斧子?”工人诧异地说，”我每天忙着砍树，哪里有时间磨斧子!”老板笑着说：”不是你的力气变小了，而是因为你的斧子已经不像第一天那样锋利了。”,4,https://mandarinbean.com/grinding-axe/
只借一美元,Borrow One Dollar,一个人走进一家银行，对经理说：”我可以借钱吗？”经理回答：”当然，只要有担保，借多少都是可以的。只要您支付6%的利息，一年后我们就会把做担保的东西还给您。”经理以为他会借很多，可是他却说：”想借一美元。”并且拿出了一沓价值50万美元的票据，说：”这些做担保可以吗？” 经理奇怪地问：”您有那么多钱，为什么还要借一美元呢？” 那个人回答：”这听起来好像很奇怪，其实我只是想以担保的形式把票据寄存在这儿，这样又安全又便宜。”,3,https://mandarinbean.com/borrow-one-dollar/
求职面试的着装颜色选择,Outfit Color for Job Interview,你选择的着装可以透露你的很多信息和你对自己的看法。那么在非常重要的求职面试中，应该穿什么颜色的衣服才能给别人留下一个好的第一印象呢？ 一项调查结果显示，蓝色和黑色是求职面试着装的最好选择，黑色代表领导力，蓝色传达出信任和信心。如果你穿黑色或者蓝色的衣服参加面试，你更可能得到这份工作。另外，灰色、棕色等颜色也是安全的选择，灰色意味着自主自信和独立思考能力，棕色意味着温暖、安全、可靠。红色传达的是热情和权力，当你想说服他人或给人留下好印象时，最适合穿红色。绿色、黄色、橙色等亮色代表创造性，但不一定能赢得别人的信任，可能不适合面试的时候穿。,4,https://mandarinbean.com/outfit-color-for-job-interview/
我喜欢的天气,The Weather I Like,在一家饭馆，有一位客人问服务员：”请问，你知道明天的天气怎么样吗？” 这位服务员笑着说：”一定会是我喜欢的天气。”客人感到很奇怪，问：”你怎么知道会是你喜欢的天气呢?”服务员回答：”我喜欢用积极的态度去面对我遇到的事情。所以，虽然我不知道明天是什么天气，但是一定会是我喜欢的。” 愉快的生活是由愉快的思想造成的。你的态度决定你的心情，影响你的健康，甚至改变你的命运。,3,https://mandarinbean.com/the-weather-i-like/
不同的回答,Different Answers,一个年轻人来到一个陌生的地方碰到一位老人，年轻人问：”这里怎么样？”老人反问：”你的家乡怎么样？”年轻人说：”糟糕极了。”老人接着说：”那你快走，这里你的家乡一样糟糕。” 又来了另一个年轻人问同样的问题，老人也同样反问，但是这个年轻人回答说：”我的家乡很好，我很想念家乡……”老人就说：”这里也同样好。” 旁观者觉得很奇怪，问老人前后回答不一样的原因。老人说：”你心里有什么，就会找到什么！” 你用欣赏的眼光去看，就会发现许多美丽的风景；然而如果你带着不满的态度去看，你就会觉得世界上的一切都很糟糕。,4,https://mandarinbean.com/different-answers/
六个馒头,Six Steamed Bread,一天早上，小和尚发现师父和大师兄都得到了六个馒头，而他只得到了四个馒头。小和尚觉得这太不公平了，于是他找到师父，也要了六个馒头。很快，小和尚就把六个馒头吃完了，他吃得很饱。 过了一会儿，小和尚觉得肚子胀，口也很渴，就去喝了半碗水。几分钟后，小和尚的肚子比刚才更胀了，他的肚子开始难受起来。 这时，师父对小和尚说：”虽然你多得到了两个馒头，但是你并没有享受到这两个馒头的好处，相反，它们给你带来了痛苦。记住，得到不一定就是享受，知足常乐。”,3,https://mandarinbean.com/six-steamed-bread/
羚羊的胜利,Victory of the Antelope,两只羚羊正在草原上吃草，就在这时，一只猎豹突然向小羚羊跑了过来。大羚羊连忙喊：”快跑！”小羚羊听到了父亲的话，迅速跑走了。大羚羊一路指挥着小羚羊，虽然猎豹的速度很快，但它一直没能追上羚羊。 跑到安全的地方后，它们停了下来，小羚羊问父亲：”为什么我们要跑呢？我们可以和猎豹对抗！”大羚羊笑了笑，说：”如果我们和它对抗，那只能更早地成为它的晚饭。面对猎豹，我们只有先认输再逃跑才能获得最后的胜利。我们的胜利不是打倒它们，而是跑得比它们快！” 面对强敌时，只有“敢于认输”并“努力逃跑”，才有机会争取到真正属于自己的胜利。,4,https://mandarinbean.com/victory-of-the-antelope/
尴尬的经历,Embarrassing Experience,星期六中午，小张要去女朋友家吃饭。因为这是第一次见女朋友的父母，所以他非常紧张。早上7点，他就起床打扮起来了。中午11点，他准时到达女朋友家门口。 小张正准备敲门时，突然发现自己的一个同事从楼下走上来。他笑着打招呼：”刘哥，你好！你也在这儿住？”就在这时，女朋友打开了门。小张赶紧介绍说：”丽丽，这是我同事刘哥。刘哥，这是我女朋友……”不过女朋友没理他，对“刘哥”说：”爸，你回来了……”,3,https://mandarinbean.com/embarrassing-experience/
学习的真谛,The Essence of Learning,曾经，有一个学生对自己的老师说：”老师！您可以把您智慧的精华都告诉我吗？这样我就能变得像您一样聪明了。” 老师笑了笑，然后拿起一个苹果，大大地咬了一口。老师看着他的学生，嘴里不断咀嚼着苹果。过了一会儿，老师把已经嚼烂的苹果吐在手中，伸出手对这个学生说：”把这些吃下去！”学生惊讶地说：”老师！这……这怎么能吃呢？”老师说：”我咀嚼过的苹果，你知道不能吃。其实，我拥有的智慧的精华就像这咀嚼过的苹果，我可以直接给你，但它已经失去了原来新鲜而甜美的滋味了。学习需要亲自去咀嚼和体会，许多答案只有经过你自己的思考才能得到。”,4,https://mandarinbean.com/the-essence-of-learning/
今天是父女节,Today Is the Festival of Father and Daughter,3月8日是妇女节，这天晚上，六岁的女儿小小拉着爸爸的手坐在沙发上看电视。 过了一会儿，妈妈买菜回家了，小小对妈妈说：”妈妈，平时总是爸爸做饭，今天你做饭吧，让我和爸爸好好享受一下节日的快乐！” 妈妈觉得很奇怪，问：”小小，你刚刚说今天是谁的节日？” 小小认真地说：”今天是我和爸爸的节日啊！妈妈，你难道不知道父女节吗？”听完后，妈妈笑了起来，说：”傻孩子，今天是妇女节，是女人们的节日！”,3,https://mandarinbean.com/today-is-the-festival-of-father-and-daughter/
黑羊的价值,The Value of Black Sheep,农夫有三只小白羊和一只小黑羊。三只小白羊常常嘲笑小黑羊又黑又脏，农夫也不喜欢它。小黑羊觉得自己不如小白羊，所以经常一个人伤心流泪。 初春的一天，小白羊与小黑羊一起外出吃草，它们走得很远。可是没想到，突然下起了大雪。雪太厚了，小羊们没有办法行走，所以只能留在那里，等待农夫来救它们。 农夫发现四只小羊不见了，便立刻上山找，但四处一片雪白，根本找不到小羊。就在这时，农夫突然发现有一个小黑点，他马上跑过去一看，果然是他的四只小羊。农夫抱起小黑羊，感慨地说：”多亏小黑羊，不然，小羊们都要冻死在雪地里了！”,4,https://mandarinbean.com/the-value-of-black-sheep/
博士与渔夫,Doctor and Fisherman,一天，一个博士坐船欣赏风景。在船上，博士问渔夫：”你会数学吗？”渔夫说不会，博士就说：”那你的生命就要失去四分之一了。” 过了一会儿，博士又问：”你会哲学吗？”渔夫还是回答不会。博士又说：”那你的生命又要失去四分之一了。” 几分钟后，博士又问了：”你会科学吗？”渔夫仍然不会。 就在这时，突然刮起了大风，渔夫问博士：”你会游泳吗？”博士说不会，渔夫说：”那你的生命可能就要结束了！”,3,https://mandarinbean.com/doctor-and-fisherman/
迟到15分钟,15 Minutes Late,如果你和别人有一个约会，但是你大概要迟到15分钟，你会怎么办？打电话告诉对方你可能要迟到15分钟吗？ 其实，在这种情况下，你倒不如说：”我也许要迟到30分钟。”假如你老实地说：”我要迟到15分钟。”那么，即使你只是迟到了14分钟，对方也会觉得已经等你很久了。可是，如果你说的是30分钟，结果只迟到了15分钟，对方会觉得你早到了。并且你本来要30分钟才赶到，但你在15分钟之内就已经到了，可见你多么重视这个约会。如果他要责怪你，便是他不近人情了。你唯一可能遇到的问题是当你说要迟到30分钟时，对方或许会感到不满。,4,https://mandarinbean.com/15-minutes-late/
