title_ch,title_eng,body,hsk_level,link改变人生的两小时,Two Hours of Life Changing,在一次同学聚会上，有一位同学引起了大家的注意，因为他的事业非常成功。但是，在大家以前的印象中，这位同学不是一位优秀的人，成绩和各方面的能力都很一般。 后来，有人问他：”你成功的秘诀是什么？”他回答：”其实也没什么，只是我把大部分时间用在了做一件事情上。” 原来，大学毕业后，他每天都会拿出两个小时来学习企业管理。几年后，他开了自己的公司。因为有丰富的积累，他的公司很快就变得越来越大。,3,https://mandarinbean.com/two-hours-of-life-changing/
荷兰男子申请改小年龄,Dutchman Sues to Lower Age,荷兰一名69岁的男子发起了一场法律诉讼，要求改变自己的年龄。埃米尔•拉特尔班德想把自己的生日从1949年3月11日改为1969年3月11日，他说：”在我们生活的时代，你可以改名字，改性别，那为什么我不能改年龄？”他希望能把年龄改小20岁，原因是他感觉自己因为年龄受到了歧视，这影响了他的就业机会和约会的成功率。他还说，如果能改变出生日期，他愿意放弃享受养老金的权利。 报道称，针对这个案件，有的法官认为目前的法律机制不允许一个人改变出生日期。其中一名法官想知道少的这20年要怎么办，比如，你父母那时候照顾的是谁？以前的那个小男孩是谁？,4,https://mandarinbean.com/dutchman-sues-to-lower-age/
杯子,Cup,有一个杯子，里面装了水，如果我问你：”这是什么？” 你会回答什么？我把水倒掉后，再问你相同的问题，你又会回答什么？当一个杯子装满水的时候，人们可能会说：”这是水。”当一个杯子装满牛奶的时候，人们可能会说：”这是牛奶。”只有杯子里什么东西也没有时，人们才会说：”看，这是一个杯子。” 其实我们也是一样，当我们心中装满了财富、成见、权势的时候，就不再是我们自己了。人往往热衷拥有很多，但往往很难真正拥有自己。,3,https://mandarinbean.com/cup/
黑色假日,The Black Holiday,很多人大概不知道，日本的劳动节是11月23日，这个节日的名字叫”勤劳感谢日”。每年到了勤劳感谢日，日本公众都能休息一天。大部分的人在这一天都会完全抛开工作烦恼，好好放松放松，但是却有人在这一天推出了”黑色假日”活动，请休息的人来体验给坏老板打工是什么感觉。 日本一直有工作时间长的传统，但即使在这种普遍的高压力的工作环境下，仍然有一些公司”脱颖而出”，因为它们完全不在乎员工是否幸福。这种公司被称为”黑公司”，任何想体验在黑公司工作的感觉，又不想真的在那里工作的人，可以通过申请”黑色假日”的特别活动来实现。,4,https://mandarinbean.com/the-black-holiday/
请不要开错窗,Please Don’t Open the Wrong Window,一个小女孩站在窗边，看窗外的人正埋葬他们可爱的小狗。小女孩看了难过得哭了起来。 她的爷爷看见了，马上把她带到了另一扇窗户旁边，让她看美丽的花园。花非常漂亮，果然小女孩看见花后，心情马上就变好了，她很快就高兴得笑了起来。爷爷对小女孩说：”孩子，你开错了窗户。你看，换了一扇窗户，世界是不是就不一样了？” 遇到失败请不要难过，打开失败旁边的窗户，也许你就看到了希望。,3,https://mandarinbean.com/please-dont-open-the-wrong-window/
五岁孩子简历走红网络,Kid’s Resume Goes Viral,最近，一个幼儿园小朋友的简历成为国内社交媒体上最火的话题。这份15页的简历非常详细地介绍了孩子较短的成长史。 这份简历似乎是用来申请国际小学的材料的一部分。在简历一开始，孩子就骄傲地介绍了自己的父母，他写道：”我的父母都毕业于复旦大学。”这个5岁的小孩说自己去年读了500多本英语书，他还写道：”我每星期写三篇英语日记来记录心情。”此外，他还说自己有丰富的课外爱好，他描述了自己在历史、数学、艺术、运动等方面的突出表现。最后，他用5页纸列出了他读过的全部英语书。 这份走红网络的简历生动地反映出我国竞争激烈的教育体制，想要去精英小学学习已经越来越难。,4,https://mandarinbean.com/kids-resume-goes-viral/
两封信,Two Letters,有一天，小明的爸爸给了小明两封信，还给了他一些钱，让他买两张邮票把信寄出去。过了十分钟，小明回来了。他高兴地对爸爸说：”爸爸，我把你给我的两封信寄出去了，而且只花了一半半的钱！” 爸爸很惊讶地问小明：”你是怎么用一半的钱把两封信寄出去的呢？” 小明得意地说：”我把一封信放在另一封信里面，这样只需要一张邮票就可以寄两封信了。爸爸，我既完成了你给我的任务，又帮你省下了一半半的钱，是不是是很聪明？”,3,https://mandarinbean.com/two-letters/
共享养狗,Shared Dogs,最近，山东省出现了一种新的服务——共享养狗。 这种共享养狗和共享单车一样，你只需要交押金，签协议，就可以去租一只宠物狗带回家养，每天十元，还免费送狗笼和狗粮。如果你不想养了，可以再送回去。但是你最多可以养两个星期，两个星期以后，如果你不愿意还回去，就必须买了。 共享养狗要求用户必须每天拍摄视频，证明你没有遗弃和虐待狗。因为成年的狗可能会因为经常换主人变得抑郁，所以共享的都是小狗，没有成年的大狗。据说，他们还会给所有的共享狗免费打疫苗，提供医疗服务。 但是也有很多人不喜欢这种方式，觉得这种共享对狗不好，也有很多安全问题。,4,https://mandarinbean.com/shared-dogs/
金蛋,Gold Egg,一天早上，一个农民发现自己的鸡生了一个金蛋。他非常高兴地把蛋带回家。从那以后，他每天早上都能得到一个金蛋，所以，他的钱变得越来越多。但是这个农民也变得越来越贪心，他觉得每天一个金蛋太慢了，他想得到鸡肚子里所有的金蛋，就把鸡杀死了。但是，鸡肚子里什么也没有，他又变成了穷人。,3,https://mandarinbean.com/gold-egg/
日企鼓励员工充足睡眠,Firm Monitors Sleep Patterns,因为社会竞争的激烈，越来越多的人选择放弃休息时间来工作，但是这样会严重影响身体健康。东京一家婚礼策划公司近日表示，将实行“睡眠报酬制度“以鼓励员工获得更多睡眠。CRAZY公司与在睡眠分析技术方面比较厉害的公司Airweave一起合作，将对员工的睡眠模式进行监控。在手机上安装睡眠分析软件，这个软件会分析人们睡眠的一些情况，CRAZY公司的员工把这些情况共享给公司，就可以根据每晚睡眠时间的多少获得积分。如果员工每天有6小时以上的睡眠时间，每星期至少5天这么做，那么他们就可以获得数百点积分，并且可以在CRAZY公司的餐厅与咖啡馆内兑换成日元(100分=100日元)使用。CRAZY公司希望这个新的奖励机制能改善员工的生活习惯与健康状况，提高他们的工作效率。,4,https://mandarinbean.com/firm-monitors-sleep-patterns/
两个女儿,Two Daughters,一位老太太有两个女儿，大女儿卖草帽，二女儿卖雨伞，老太太每天愁眉苦脸的。 一位邻居问她为什么。老太太说：“下雨天，我担心大女儿的遮阳草帽卖不出去；可是等天晴了吧，我又担心二女儿的雨伞卖不出去，你说我能不发愁吗？” 邻居听完笑着说：“一到下雨天，您二女儿的雨伞就卖得特别好；天一晴，您大女儿的店里顾客就会变多。无论天晴还是下雨都好，真让人羡慕！” 看事情的方式决定了你的生活质量，积极乐观的生活态度才是最重要的。,3,https://mandarinbean.com/two-daughters/
人口老龄化致宠物狗失宠,Number of Pet Dogs Slides,今年日本宠物猫的数量第一次超过了宠物狗的数量，日本宠物食品协会发布的一项调查显示，2017年宠物猫的数量估计有952.6万只，几乎与前几年差不多；而宠物狗的数量已经连续下降了三年，现在大约只有892万条。 有专家表示，人口老龄化和更高的养狗成本也许是造成日本宠物狗数量下降的原因。日本宠物食品协会称，从出生到死养一条狗大约要花160万日元，而养一只猫大约需要108万日元，这一费用差别可能影响了人们的选择。另外，由于认为照顾狗的要求更高，比如，主人要每天外出遛狗，并且负有法律责任为狗注射疫苗，更多老年人选择放弃养狗而去养猫。,4,https://mandarinbean.com/number-of-pet-dogs-slides/
不同的看法,Different Perspectives,有两个妇人在聊天，其中一个问：“你儿子过得怎么样？” 另外一个妇人难过地说：“不好，他实在是太可怜了，娶了个很懒的媳妇，不做饭、不洗衣服、不带孩子，每天只知道睡觉。我儿子还要把早饭拿到她的床上给她吃呢！” “那女儿呢？”那个妇人问。 她高兴地说：“她嫁了一个不错的丈夫，从来不让她做家务，做饭、洗衣服、带孩子都是她丈夫做的，而且每天早上我女婿还会把早饭拿到床上给她吃呢！” 多站在别人的角度看一看，或许你会有不同的看法。,3,https://mandarinbean.com/different-perspectives/
最佳结婚年龄,Best marriage age,爱情没有年龄限制，但是结婚却有最佳年龄。美国社会学家的研究表明，最佳结婚年龄段是28-32岁，在这之前或者之后都不推荐，因为32岁以后每晚结婚一年，离婚率都会增加5%。而在28-32岁这个年龄段结婚的人，是离婚率最低的。 这个现象的原因有很多，比如这个年龄的人很容易知道两人是不是因为合适在一起，而不仅是因为荷尔蒙；他们也逐渐开始有了责任感和人生计划；经济上也可以满足两个人的生活需要。而32岁以上的人，很多习惯已经很难改变了，也可能有很多不确定因素会消耗两个人的时间和精力。 当然，婚姻中每对夫妻的情况都不一样，最重要的是懂得沟通，有自己的空间，为彼此创造舒服的环境。,4,https://mandarinbean.com/best-marriage-age/
扔掉孩子的玩具,Throw away the child’s toys,孩子都喜欢有更多的玩具。虽然家里已经有很多玩具了，他们还是想要买更多更新的。这也是很多爸爸妈妈的烦恼。 有一位美国妈妈分享了她的经验。她有一个6岁的大女儿和一个3岁的小女儿，因为大女儿想买一个新玩具，但是妈妈觉得已经有很多玩具了，就拒绝了她。结果，女儿一直不开心。回家后，这个妈妈用了两天时间收拾女儿们的房间，然后把所有的玩具都扔了。开始，这个妈妈还有点儿担心，但是一个月以后，她发现孩子们不再想要新的玩具了，也能享受和家人旅行的时间了。 很多爸爸妈妈都同意这个妈妈的方法，但是也有一些人不同意。你觉得呢？,3,https://mandarinbean.com/throw-away-the-childs-toys/
女性在开放式办公室更注重着装打扮女性在開放式辦公室更注重著裝打扮,Women Pay More Attention to Dressing in Open Workspaces,从个人的小办公室搬到开放式办公室后，你是不是比原来更加在意别人的眼光？最新研究表明，女性在开放式办公室对自己的穿着打扮会更加在意，还会花很多钱买衣服。 办公室里有很多让人感到压力的人和事，不过，开放式办公室似乎还带给女性另一种压力——她们的外表。一项研究发现，现代的开放式办公室带给女性的这种压力使她们对着装更加讲究。研究人员花了三年时间，研究了大约1000名职员的穿着行为后发现，女性从单独的办公室搬到开放的大办公室后，会感到“哪里都有人在看你”。这会让她们更注意个人形象，但也会让她们觉得很不舒服。因为会遇到更多的人，所以她们穿衣服的标准可能也会提高。,4,https://mandarinbean.com/women-pay-more-attention-to-dressing-in-open-workspaces/
尊重,Respect,有一个人经过热闹的火车站，看到一个残疾人在卖东西，他随手丢下了一百元。但是不久，这个人又回来了，他抱歉地对这个残疾人说：“不好意思，你是一个生意人，我竟然把你当成一个乞丐。” 过了一段时间，他再次经过火车站，一个商店的老板在门口笑着叫住他。“我一直期待你的出现。”那个残疾人说，“你是第一个把我当成生意人的人，你看，我现在是一个真正的生意人了。” 用心地去尊重每一个人，你的尊重可能会给别人很好的影响。,3,https://mandarinbean.com/respect/
霜降,Frost Falls,霜降是二十四节气中秋天的最后一个节气，一般在每年的10月23日左右。霜降的意思是天气逐渐变冷，开始有霜，冬天即将开始。 这个时候是吃红柿子的好季节，人们也应该注意防止秋天的干燥和可能出现的抑郁情绪，也要注意保暖。,4,https://mandarinbean.com/frost-falls/
秋天,Autumn,秋天，又叫秋季，是一年中的第三个季节。每年的9月到11月是中国的秋天。如果五天的平均气温都在22度以下就进入了秋季，低于10度的时候，秋季就结束了。天气会越来越冷，有“一场秋雨一场凉”的说法。这也是吃红柿子和大闸蟹的季节。北方的植物开始变黄，变红，也是旅游的好时候。,3,https://mandarinbean.com/autumn/
中国正兴起咖啡热,Coffee Is Becoming More and More Popular in China,如今，咖啡已经成为越来越多中国年轻人的选择。最近，哥伦比亚广播公司报道称，咖啡在中国越来越受欢迎。现在，咖啡，而不是茶，正成为中国年轻人最爱的饮品。在过去的四年间，中国咖啡消费量增加到了原来的8倍，咖啡进口量每年增长16%。 戴夫·赛敏斯卡刚刚来中国时，在苹果公司工作，发现了咖啡在中国市场的发展潜力后，他就在中国开了咖啡店。他认为：“中国的年轻一代受到西方文化影响。在未来的30年中，中国将会进口200万到300万吨咖啡。”中国的咖啡市场仍有很大的增长空间，中国的人均年咖啡消费量为3杯，而这一数字在英国为250，在美国为363。,4,https://mandarinbean.com/coffee-is-becoming-more-and-more-popular-in-china/
狮子和羚羊,Lion and Antelope,每天，当太阳升起来的时候，非洲大草原上的动物们就开始奔跑了。狮子妈妈在教育自己的孩子：“孩子，你必须跑得再快一点，再快一点，你要是跑不过最慢的羚羊，你就会被饿死。”在另外一个地方，羚羊妈妈也在教育自己的孩子：“孩子，你必须跑得再快一点，再快一点，如果你不能比跑得最快的狮子还快，那你就肯定会被他们吃掉，成为他们的食物。” 请记住：你跑得快，别人跑得更快，所以我们要不断地提高自己。,3,https://mandarinbean.com/lion-and-antelope/
父母学业成绩对男性的压力,Parental Study Performance Pressure on Men,父母经常会说，别人家的孩子分数多么高，来激励自己的孩子努力学习。但他们可能没有想到，自己的学业成绩也可能导致孩子承受心理的压力和痛苦。这种影响在男性身上体现得比较明显。研究显示，对男性来说，学业成绩比父母差的痛苦程度和离婚差不多。 研究人员把父母和孩子的受教育程度与他们的心理状态进行对比。牛津大学的研究人员发现，超过父母的受教育程度能减少男性的心理痛苦，但不及父母的受教育程度却会增加心理痛苦。然而女性好像不会受到学业比父母差的影响。古古什维利博士说：“我们考虑了很多原因，我们觉得可能是，男性比女性更容易认为失败是由个人的缺点和能力导致的。”,4,https://mandarinbean.com/parental-study-performance-pressure-on-men/
楚人学齐语,Chu People Learn the Language of Qi State,从前，楚国有个人想让儿子学说齐国话，可是请齐国人教他好呢，还是请楚国人教他好呢？这个楚国人觉得：“当然是请齐国人教他好啊！”于是便请了一个齐国人来教儿子。 但是周围一直有许多楚国人在说话，所以虽然请了齐国人教他，并且每天学习，他的儿子最终还是没有学会说齐国话。 后来，这个人把儿子带到齐国住了几年，结果他的儿子很快就会说齐国话了。相反，你再让他说楚国话，尽管每天打他，他也不会说了。,3,https://mandarinbean.com/chu-people-learn-the-language-of-qi-state/
星巴克在中国,Starbucks in China,作为世界著名的咖啡连锁店，星巴克已经成为了中国年轻人喝咖啡的首选。无论是北京这样的大城市，还是一些偏远的小城市，你都能喝到星巴克咖啡。很多人称星巴克为“星爸爸”。 尽管很多人抱怨星巴克的咖啡太贵，味道也不好，但是不可否认，因为星巴克的普及，越来越多的年轻人开始把咖啡作为一天的开始，把它融入到每天的生活中。当你想坐下来休息一下，或者和朋友约会见面时，不管是在机场、火车站还是在公司楼下，你都能找到星巴克。 灵隐寺旁边的星巴克很独特，它改变了以往的风格，融入了很多中国的元素和装饰，使它与周围的环境更协调。另外，星巴克在每个城市还推出了带有当地独特风格的“城市杯”。,4,https://mandarinbean.com/starbucks-in-china/
袋鼠与笼子,Kangaroo and Cage,一天，有人发现袋鼠从笼子里跑出来了。大家经过讨论认为，是因为笼子太低了，所以他们决定把笼子的高度从10米加高到20米。结果第二天，他们发现袋鼠还是跑到了外面，所以他们又决定把高度加高到30米。但是加高后，他们居然又看到袋鼠跑到了外面，于是他们决定把笼子的高度加高到100米，他们觉得这样袋鼠一定跑不出去了。 长颈鹿看到了，问袋鼠：“你们觉得这些人会不会继续加高你们的笼子？”袋鼠说∶“很难说，如果他们再继续忘记关门，我们还是会跑出去，他们可能就会继续加高笼子！”,3,https://mandarinbean.com/kangaroo-and-cage/
郑人买履,Buying a Pair of Shoes,从前有个郑国人，他打算到集市上买双鞋子。于是，他先把自己脚的长短量了一下，然后来到了集市上，找到卖鞋的地方。正要买鞋时，它忽然想尺码忘在家里了，于是赶紧往家跑。 他跑回家后，拿了尺码，等他再跑回集市时，集市已经散了。别人知道了这件事，觉得很奇怪，就问他：“你为什么不用自己的脚去试试鞋子呢？”这个买鞋的郑国人说：“我相信我量过的尺码很准确，至于脚，那就不一定可靠了。” 这个郑国人只相信自己量脚得到的尺码，而不相信自己的脚，最终不但没买到鞋子，还成为了别人的笑柄。所以我们做事要从实际出发，学会灵活变通。,4,https://mandarinbean.com/buying-a-pair-of-shoes/
同情,Sympathy,小宝经常浪费食物，为了教育他，爸爸决定给他讲一下自己小时候的艰苦生活。他说：“小宝，食物很珍贵，浪费食物是不对的。爸爸小时候家里很穷，有时候甚至会饿肚子。你现在多么幸福啊，有这么多东西可以吃！你知道自己以后应该怎么做了吗？” 说到这里，爸爸觉得小宝应该已经明白了，但是小宝却哭着说：“爸爸，你小时候太可怜了，你早点到我们家来就不用饿肚子了！”,3,https://mandarinbean.com/sympathy/
曾参杀猪,Zeng Shen Kills Pigs,曾参是春秋时期道德修养很高的人。有一天早晨，曾参的妻子准备到集市上去买点儿东西。小儿子看见了，一定要跟妈妈一起去。曾参的妻子没办法，就随口说:”好孩子，你听话，妈妈回来给你杀猪吃肉。” 不久，曾参的妻子从集市上回来了，只见曾参正在磨刀准备杀猪。她立即阻止了丈夫。曾参却指着站在旁边兴奋的小儿子说：“刚才你出门时跟孩子说了什么，难道忘了吗？” “哎呀，我那是骗他的，只是想让他留在家里。”妻子说。 曾参严肃起来：“孩子还不懂事，他的行为都是跟大人学的。我们承诺了却不做，那是在教孩子撒谎。”,4,https://mandarinbean.com/zeng-shen-kills-pigs/
好消息,Good News,公布考试成绩的日子到了，儿子又不及格。他害怕爸爸不高兴，所以想了一个办法。从学校回来后，他对父亲说：“我有一个好消息和一个坏消息，你想先听哪个？” “坏消息！”父亲严肃地说。 “我这次考试不及格。”儿子胆怯地回答。父亲听了非常生气，但是他想听听好消息是什么，于是问：“那好消息呢？” 儿子骄傲地说：“老师说你不用给我交下学期的学费了！爸爸，你工作那么辛苦，我终于不用浪费你的钱了！”,3,https://mandarinbean.com/good-news/
开放式办公室的秘密,The Secret of Open Office,许多传统办公室会把每名员工的桌子隔开，但现在许多办公室都放弃这种方式，选择“开放式”的办公室设计。有研究发现，这种开放式办公室能改善员工健康。 美国亚利桑那大学通过研究指出，原因是开放式办公室缺乏隐私，使员工离开自己的桌子，为自己寻找私人空间。研究发现，在开放式办公室上班的人活动的时间比在传统办公室的人多约20%，他们比有私人办公室的人活动的时间多约32%。研究也发现，在办公室经常活动的人比经常坐在桌子前的人压力更小。 开放式办公室一直被认为减少了员工的私人空间，但亚利桑那大学的研究指出，其实开放式办公室还有许多好处，包括可以鼓励员工的沟通，也可以让他们更在意其他同事。,4,https://mandarinbean.com/the-secret-of-open-office/
逆向思维,Reverse Thinking,有个人向哈桑借了2000元，并且写了借据。在还钱的期限快到的时候，哈桑突然发现借据丢了，这使他非常焦急！因为他知道，丢了借据，向他借钱的这个人是会赖账的。 哈桑的朋友知道此事后，对哈桑说：“你给这个人写封信过去，要他到时候把向你借的2500元还给你。”哈桑听了很迷惑：“我丢了借据，要他还2000元都是个问题，怎么还能向他要2500元呢？”尽管哈桑没想明白，但还是照办了。 信寄出以后，哈桑很快收到了回信，借钱的人在信上写道：“我向你借的是2000元钱，不是2500元，到时候就还你。” 这就是逆向思维，逆向思维会让你打开新世界的大门。,3,https://mandarinbean.com/reverse-thinking/
老虎,Tiger,有两只老虎，一只在笼子里，一只在森林里。在笼子里的老虎很安逸，在森林里的老虎很自由。两只老虎经常一起聊天，笼子里的老虎总是羡慕森林里老虎的自由，森林里的老虎却羡慕笼子里老虎的安逸。 一天，一只老虎对另一只老虎说：“咱们换一换，怎么样？”另一只老虎同意了。于是，笼子里的老虎走进了大自然，森林里的老虎走进了笼子。从笼子里走出的老虎很高兴，在森林里拼命地奔跑；走进笼子的老虎也十分快乐，他再也不用为食物而发愁。 但不久，两只老虎都死了。一只老虎饥饿而死，另一只忧郁而亡。从笼子里走出的老虎获得了自由，却没有获得捕食的本领；走进笼子的老虎获得了安逸，却没有获得在狭小空间生活的心境。,4,https://mandarinbean.com/tiger/
别让手机绑架了你,Don’t Let the Cell Phone Kidnap You,我的生活被手机绑架了，我不知道这是从什么时候开始的。我已经不再和朋友们进行真正的交谈了，我们只是在社交网络上发发信息、发发表情。我甚至都很少和家人说话了，他们也都在各自的手机上有着精彩的生活，就像我一样。 有时候，我会突然想和家人朋友一起吃饭、聊天的日子，我发现自己真的很怀念那种日子。对，手机的世界很精彩，我们可以玩游戏、购物、聊天等等。但是，我们需要拿出更多的时间和家人朋友相处，和现实世界相处。,3,https://mandarinbean.com/dont-let-the-cell-phone-kidnap-you/
